{
  "$schema": "../schema/release-request.schema.json",
  "schema_version": "orchestra.compliance-registry.release-request.v1",
  "status": "AUTHORIZED_FOR_PUBLICATION",
  "registry_version": "0.4.0",
  "release_sequence": 4,
  "release_tag": "registry-v0.4.0",
  "source_commit": "488c979b37dd84d8645fd8e6c288d297375c4e5b",
  "source_tree": "0d3bbf34ec7ab7e4833fba225aba96b829de1cec",
  "source_registry_version": "0.2.0-dev.1",
  "source_registry_status": "DRAFT",
  "authorization": {
    "type": "EXPLICIT_HUMAN_APPROVAL",
    "approved_at": "2026-08-28",
    "scope": [
      "CANONICAL_MERGE",
      "TRUSTED_RELEASE_PUBLICATION",
      "O7_7_JOINT_CONFORMANCE",
      "PADAYON_RECONCILIATION"
    ]
  },
  "publication_requirements": {
    "official_source_provenance_validation": true,
    "exact_source_validation": true,
    "deterministic_double_build": true,
    "non_draft_release": true,
    "non_prerelease_release": true,
    "immutable_release": true,
    "release_assets_required": [
      "orchestra-compliance-registry.zip",
      "orchestra-compliance-registry.zip.sha256",
      "release-manifest.json",
      "release-manifest.sha256"
    ],
    "post_publication_reverification": true,
    "padayon_update_required": true
  }
}
